{
  "schema_version": "vnext.asset_status/1.0.1",
  "vnext_effective": false,
  "contract_version_in_effect": "1.3.0",
  "migrated_from": [
    {
      "path": "art/full/art_complete_catalog.json",
      "sha256": "96f9e52e2acd1cf95bbcfef95c3a5f00204628a0f0f452be832552942636e248"
    },
    {
      "path": "art_review/reports/independent_20261024/defects.json",
      "sha256": "a5f48dca483c840ec95c9073d8b579ed8a8c0ce08bfacfcd2a21fa3c420fc3de"
    }
  ],
  "migrated_at": "2026-10-25T00:00:00Z",
  "package": {
    "asset_id": "CATALOG",
    "record_kind": "package",
    "technical_state": "missing",
    "visual_state": "not_reviewed",
    "behavior_state": "not_tested",
    "release_state": "blocked",
    "release_state_reason": "未解blocking/major问题8项: R01,R02,R03,R04,R05,R06,R07,R08",
    "issues": [
      {
        "issue_id": "R08",
        "severity": "major",
        "status": "open",
        "title": "技术自检覆盖了文件，却没有完成风格放行",
        "affected_scope": "catalog_process",
        "evidence": [
          "art/full/reviews/ENV006.json",
          "art/full/art_complete_catalog.json"
        ],
        "source_review": "art_review/reports/independent_20261024"
      },
      {
        "issue_id": "R09",
        "severity": "minor",
        "status": "open",
        "title": "UI纸片样式单一，透景与涂鸦弱",
        "affected_scope": "ui_family",
        "evidence": [
          "art/full/previews/engine/dialogue_npc_1280x720.png",
          "art/full/previews/engine/ui_states/toast_task_update.png"
        ],
        "source_review": "art_review/reports/independent_20261024"
      },
      {
        "issue_id": "R10",
        "severity": "minor",
        "status": "open",
        "title": "目录/规则仍有旧信息，审核状态存在歧义",
        "affected_scope": "catalog_docs",
        "evidence": [
          "art/full/art_complete_catalog.json"
        ],
        "source_review": "art_review/reports/independent_20261024"
      }
    ],
    "historical_notes": [
      "catalog_status=engine_verified_pending_independent_review"
    ],
    "mapping": {
      "old_status": "engine_verified_pending_independent_review",
      "old_decision": null,
      "old_reviewer": null
    },
    "technical_evidence": {
      "review_kind": "technical_self_check",
      "reviewer": "producer technical engine check (not independent stage signoff)",
      "decision": "engine_verified_pending_independent_review",
      "evidence": [
        "art/full/art_complete_catalog.json"
      ],
      "source_file": "art/full/art_complete_catalog.json",
      "limitations": []
    },
    "open_issue_ids_all": [
      "R01",
      "R02",
      "R03",
      "R04",
      "R05",
      "R06",
      "R07",
      "R08",
      "R09",
      "R10"
    ],
    "decision_source": "rework",
    "accepted": false
  },
  "items": [
    {
      "asset_id": "CHAR001",
      "record_kind": "asset",
      "technical_state": "import_verified",
      "visual_state": "not_reviewed",
      "behavior_state": "not_tested",
      "release_state": "reviewed_not_released",
      "release_state_reason": "包含于2026-10-24独立返修整体结论(review_gate blocked/H02)；无本条目未解blocking/major问题；released只能由外部控制器产生",
      "issues": [],
      "historical_notes": [
        "换源已由用户/控制器于 2026-10-24 批准为 1015_aglna2 default；旧 291 证据保留历史。",
        "独立 H09/H05 视觉审核仍未完成；本模型是 alter，不是 291 的 skin。",
        "未做 Cocos/微信导入；未验证背面、完整动作和接地。"
      ],
      "mapping": {
        "old_status": "engine_verified",
        "old_decision": "pass",
        "old_reviewer": "producer technical engine check (not independent stage signoff)"
      },
      "group": "CHAR",
      "kind": "spine",
      "technical_evidence": {
        "review_kind": "technical_self_check",
        "reviewer": "producer technical engine check (not independent stage signoff)",
        "decision": "pass",
        "reviewed_at": "2026-10-24",
        "evidence": [
          "art/full/previews/engine/assets/CHAR001.png"
        ],
        "source_file": "art/full/reviews/CHAR001.json",
        "limitations": []
      }
    },
    {
      "asset_id": "CHAR002",
      "record_kind": "asset",
      "technical_state": "import_verified",
      "visual_state": "not_reviewed",
      "behavior_state": "not_tested",
      "release_state": "reviewed_not_released",
      "release_state_reason": "包含于2026-10-24独立返修整体结论(review_gate blocked/H02)；无本条目未解blocking/major问题；released只能由外部控制器产生",
      "issues": [],
      "historical_notes": [
        "真实动作清单/idle/Move 已从 1015 runtime 重新产出；H09/H05 独立审核未完成。",
        "尚无 Cocos 引擎导入和游戏内动作调校；不能计 engine_verified。"
      ],
      "mapping": {
        "old_status": "engine_verified",
        "old_decision": "pass",
        "old_reviewer": "producer technical engine check (not independent stage signoff)"
      },
      "group": "CHAR",
      "kind": "animation",
      "technical_evidence": {
        "review_kind": "technical_self_check",
        "reviewer": "producer technical engine check (not independent stage signoff)",
        "decision": "pass",
        "reviewed_at": "2026-10-24",
        "evidence": [
          "art/full/previews/engine/assets/CHAR002.png"
        ],
        "source_file": "art/full/reviews/CHAR002.json",
        "limitations": []
      }
    },
    {
      "asset_id": "CHAR003",
      "record_kind": "asset",
      "technical_state": "import_verified",
      "visual_state": "not_reviewed",
      "behavior_state": "not_tested",
      "release_state": "reviewed_not_released",
      "release_state_reason": "包含于2026-10-24独立返修整体结论(review_gate blocked/H02)；无本条目未解blocking/major问题；released只能由外部控制器产生",
      "issues": [],
      "historical_notes": [
        "用户/控制器已批准静态切片路线；mask 是手工向量遮罩，边缘/局部背景仍需清理复核。",
        "P1 参考是暖光低分辨率视频帧；无背面、无干净全身板。",
        "未导入 Cocos/微信，未做独立角色卡审核。"
      ],
      "mapping": {
        "old_status": "engine_verified",
        "old_decision": "pass",
        "old_reviewer": "producer technical engine check (not independent stage signoff)"
      },
      "group": "CHAR",
      "kind": "spine_or_layered",
      "technical_evidence": {
        "review_kind": "technical_self_check",
        "reviewer": "producer technical engine check (not independent stage signoff)",
        "decision": "pass",
        "reviewed_at": "2026-10-24",
        "evidence": [
          "art/full/previews/engine/assets/CHAR003.png"
        ],
        "source_file": "art/full/reviews/CHAR003.json",
        "limitations": [
          "Static cutout + subtle sway; no official t054 Spine exists.",
          "Edges approximate at native video resolution."
        ]
      }
    },
    {
      "asset_id": "CHAR004",
      "record_kind": "asset",
      "technical_state": "import_verified",
      "visual_state": "not_reviewed",
      "behavior_state": "not_tested",
      "release_state": "reviewed_not_released",
      "release_state_reason": "包含于2026-10-24独立返修整体结论(review_gate blocked/H02)；无本条目未解blocking/major问题；released只能由外部控制器产生",
      "issues": [],
      "historical_notes": [
        "独立审核与 Cocos 导入未做；是 chibi runtime 裁切，不是专属官方头像。"
      ],
      "mapping": {
        "old_status": "engine_verified",
        "old_decision": "pass",
        "old_reviewer": "producer technical engine check (not independent stage signoff)"
      },
      "group": "CHAR",
      "kind": "portrait",
      "technical_evidence": {
        "review_kind": "technical_self_check",
        "reviewer": "producer technical engine check (not independent stage signoff)",
        "decision": "pass",
        "reviewed_at": "2026-10-24",
        "evidence": [
          "art/full/previews/engine/assets/CHAR004.png"
        ],
        "source_file": "art/full/reviews/CHAR004.json",
        "limitations": []
      }
    },
    {
      "asset_id": "CHAR005",
      "record_kind": "asset",
      "technical_state": "import_verified",
      "visual_state": "not_reviewed",
      "behavior_state": "not_tested",
      "release_state": "reviewed_not_released",
      "release_state_reason": "包含于2026-10-24独立返修整体结论(review_gate blocked/H02)；无本条目未解blocking/major问题；released只能由外部控制器产生",
      "issues": [],
      "historical_notes": [
        "P1 参考裁切分辨率有限；独立审核与引擎验证未做；与全身静态切片一样需复核。"
      ],
      "mapping": {
        "old_status": "engine_verified",
        "old_decision": "pass",
        "old_reviewer": "producer technical engine check (not independent stage signoff)"
      },
      "group": "CHAR",
      "kind": "portrait",
      "technical_evidence": {
        "review_kind": "technical_self_check",
        "reviewer": "producer technical engine check (not independent stage signoff)",
        "decision": "pass",
        "reviewed_at": "2026-10-24",
        "evidence": [
          "art/full/previews/engine/assets/CHAR005.png"
        ],
        "source_file": "art/full/reviews/CHAR005.json",
        "limitations": []
      }
    },
    {
      "asset_id": "ENV001",
      "record_kind": "asset",
      "technical_state": "import_verified",
      "visual_state": "not_reviewed",
      "behavior_state": "not_tested",
      "release_state": "reviewed_not_released",
      "release_state_reason": "包含于2026-10-24独立返修整体结论(review_gate blocked/H02)；无本条目未解blocking/major问题；released只能由外部控制器产生",
      "issues": [],
      "historical_notes": [
        "Cocos 导入/引擎截图未做；程序化材质未烘焙为引擎贴图；UV 未展开。",
        "石板 5,196 tris/16m²，铺满全图的预算需合并/实例化后再验证。",
        "独立审核未做。"
      ],
      "mapping": {
        "old_status": "engine_verified",
        "old_decision": "pass",
        "old_reviewer": "producer technical engine check (not independent stage signoff)"
      },
      "group": "ENV",
      "kind": "model",
      "technical_evidence": {
        "review_kind": "technical_self_check",
        "reviewer": "producer technical engine check (not independent stage signoff)",
        "decision": "pass",
        "reviewed_at": "2026-10-24",
        "evidence": [
          "art/full/previews/engine/assets/ENV001.png"
        ],
        "source_file": "art/full/reviews/ENV001.json",
        "limitations": []
      }
    },
    {